{
  "schema_version": "mlflow_tracking_contract_v1",
  "status": "ACTIVE",
  "mlflow_version": "3.14.0",
  "training_experiment": "credit-risk-modeling",
  "registered_model_name": "credit-risk-predictor",
  "tracking_key_version": "tracking_key_v1",
  "run_structure": "parent_with_model_children",
  "required_run_tags": [
    "researchops.project",
    "researchops.run_kind",
    "researchops.tracking_key",
    "researchops.source_artifact_id",
    "researchops.source_manifest_uri",
    "researchops.source_manifest_sha256",
    "researchops.source_commit",
    "researchops.stage_registry_sha256",
    "researchops.integration_state"
  ],
  "required_training_parameters": [
    "dataset_release_id",
    "feature_matrix_artifact_id",
    "split_artifact_id",
    "preprocessor_artifact_id",
    "algorithm",
    "algorithm_version",
    "random_seed",
    "preprocessing_version",
    "training_contract_version",
    "model_input_contract_version",
    "source_commit",
    "environment_snapshot_id",
    "stage_registry_sha256",
    "stage_id",
    "stage_version"
  ],
  "metric_mapping": {
    "roc_auc": "auroc",
    "average_precision": "pr_auc",
    "brier_score": "brier_score",
    "precision": "precision",
    "recall": "recall",
    "f1": "f1",
    "positive_prediction_rate": "positive_prediction_rate",
    "tn": "true_negative_count",
    "fp": "false_positive_count",
    "fn": "false_negative_count",
    "tp": "true_positive_count",
    "threshold": "decision_threshold"
  },
  "integration_states": [
    "DISCOVERED",
    "RUN_CREATED",
    "METADATA_LOGGED",
    "MODEL_LOGGED",
    "MODEL_VERSION_REGISTERED",
    "RECEIPT_PUBLISHED",
    "CANDIDATE_EVALUATED",
    "COMPLETE",
    "FAILED_MANIFEST",
    "FAILED_METADATA",
    "FAILED_MODEL_LOG",
    "FAILED_REGISTRATION",
    "FAILED_RECEIPT",
    "FAILED_RECONCILIATION"
  ],
  "stable_status_values": ["PENDING", "PASSED", "FAILED", "ELIGIBLE", "REJECTED", "SELECTED", "CANDIDATE", "CHAMPION"]
}
